URL,Platform,Title,Topic/Pain Point,Category
https://news.ycombinator.com/item?id=39458264,Hacker News,"The killer app of Gemini Pro 1.5 is using video as an input (1136pts/484c)",Video-as-input is the most transformative Gemini capability; full movie understanding demos,Gemini/Multimodal API
https://news.ycombinator.com/item?id=42397344,Hacker News,"Gemini 2.0: Multimodal Live API",Gemini 2.0 Live API supporting text/audio/image/camera/screen via WebSocket and WebRTC,Gemini/Multimodal API
https://news.ycombinator.com/item?id=41359990,Hacker News,"Show HN: Multimodal Gemini YouTube Chat with full visual understanding",Tool using Gemini multimodal API to chat about YouTube videos with audio+visual understanding,Gemini/Multimodal API
https://news.ycombinator.com/item?id=42441038,Hacker News,"Show HN: Simple demo tool for Gemini 2.0 Flash object detection",Real-time object detection from camera feeds using Gemini 2.0 Flash,Gemini/Multimodal API
https://news.ycombinator.com/item?id=46654284,Hacker News,"Show HN: React hook for Gemini Live API -- real-time voice and screen sharing",React hook enabling full-duplex voice streaming with screen sharing via Gemini Live API,Gemini/Multimodal API
https://news.ycombinator.com/item?id=44807328,Hacker News,"Real-Time Boxing Coaching with Gemini Live + Ultralytics YOLO",Combining Gemini Live streaming video with YOLO for real-time sports coaching,Gemini/Multimodal API
https://news.ycombinator.com/item?id=44134709,Hacker News,"Live video feed for every multimodal model not just Gemini",Discussion of live video feed support across different multimodal models,Gemini/Multimodal API
https://news.ycombinator.com/item?id=40926734,Hacker News,"Vision language models are blind (451pts/191c)",Paper showing VLMs fail at basic visual tasks; fundamental limitations exposed,VLM/Video Understanding
https://news.ycombinator.com/item?id=43968897,Hacker News,"FastVLM: Efficient vision encoding for VLMs (367pts/74c)",Apple research on faster VLM inference without sacrificing accuracy,VLM/Video Understanding
https://news.ycombinator.com/item?id=43115079,Hacker News,"Helix: Vision-language-action model for humanoid control (303pts/170c)",VLA model combining visual perception with language for robot control,VLM/Video Understanding
https://news.ycombinator.com/item?id=43187209,Hacker News,"Replace OCR with Vision Language Models (292pts/125c)",Whether modern VLMs can replace traditional OCR pipelines entirely,VLM/Video Understanding
https://news.ycombinator.com/item?id=42330491,Hacker News,"PaliGemma 2: Powerful VLMs with Simple Fine-Tuning (218pts/27c)",Google PaliGemma 2 open VLMs designed for easy fine-tuning on custom tasks,VLM/Video Understanding
https://news.ycombinator.com/item?id=42171043,Hacker News,"LLaVA-O1: Let Vision Language Models Reason Step-by-Step (177pts/32c)",Chain-of-thought reasoning for VLMs improving complex visual task solving,VLM/Video Understanding
https://news.ycombinator.com/item?id=44169413,Hacker News,"Vision Language Models Are Biased (176pts/141c)",Systematic biases in VLMs and implications for real-world deployment,VLM/Video Understanding
https://news.ycombinator.com/item?id=42419505,Hacker News,"Llama.cpp Now Supports Qwen2-VL (155pts/50c)",Local/edge VLM inference via llama.cpp; users reporting good quality,VLM/Video Understanding
https://news.ycombinator.com/item?id=43045801,Hacker News,"Benchmarking VLMs on OCR in dynamic video environments (142pts/58c)",New benchmark with 1477 annotated video frames comparing VLM OCR vs traditional,VLM/Video Understanding
https://news.ycombinator.com/item?id=42143404,Hacker News,"Omnivision-968M: VLM with 9x Tokens Reduction for Edge Devices",Sub-1B parameter VLM viable for edge/mobile deployment,VLM/Video Understanding
https://news.ycombinator.com/item?id=40308044,Hacker News,"VideoPrism: A foundational visual encoder for video understanding (106pts/23c)",Google foundational video encoder for general-purpose video understanding,VLM/Video Understanding
https://news.ycombinator.com/item?id=44794508,Hacker News,"Monitor your security cameras with locally processed AI (602pts/253c)",Running AI inference on security camera feeds entirely locally; privacy benefits,Security Camera AI
https://news.ycombinator.com/item?id=45003420,Hacker News,"Show HN: Clearcam -- AI object detection for IP CCTV (233pts/66c)",Open-source YOLOv8+ByteTrack for adding AI detection to existing CCTV systems,Security Camera AI
https://news.ycombinator.com/item?id=38321413,Hacker News,"Frigate: Open-source NVR with real-time AI object detection",Leading open-source NVR with Google Coral TPU support for person/vehicle detection,Security Camera AI
https://news.ycombinator.com/item?id=42284412,Hacker News,"Show HN: Open-source private home security camera (E2E encryption)",Privacy-first open-source security camera with end-to-end encryption,Security Camera AI
https://news.ycombinator.com/item?id=41772551,Hacker News,"Video Surveillance with YOLO+LLaVA",Combining YOLO + LLaVA for local video surveillance with NL scene descriptions,Security Camera AI
https://news.ycombinator.com/item?id=46756031,Hacker News,"Show HN: Root -- Privacy-preserving home security camera",Privacy-preserving home security keeping all data local,Security Camera AI
https://news.ycombinator.com/item?id=44791984,Hacker News,"Thingino: Open-Source Firmware for IP Cameras",Open-source firmware for Ingenic SoC cameras enabling custom AI and streaming,Security Camera AI
https://news.ycombinator.com/item?id=42779330,Hacker News,"Show HN: Using YOLO to Detect Office Chairs in 40M Hotel Photos (222pts/124c)",Large-scale CV pipeline engineering scanning 40M photos with YOLO,Object Detection
https://news.ycombinator.com/item?id=44146858,Hacker News,"YOLO-World: Real-Time Open-Vocabulary Object Detection (148pts/52c)",YOLO variant detecting arbitrary objects from text descriptions at real-time speed,Object Detection
https://news.ycombinator.com/item?id=42342038,Hacker News,"Show HN: Real-Time YOLO Object Detection in Elixir (96pts/11c)",Real-time YOLO inference in Elixir/Erlang showing BEAM can handle CV workloads,Object Detection
https://news.ycombinator.com/item?id=44868563,Hacker News,"Show HN: Real-time privacy protection for smart glasses (42pts/34c)",Real-time face blurring and redaction for smart glasses video feeds,Smart Glasses/Wearable
https://news.ycombinator.com/item?id=43316838,Hacker News,"EgoLife: AI Assistant on Glasses with 7-Day Video Capturing",6 volunteers wore Meta Aria glasses for 300+ hours to build long-term AI assistant,Smart Glasses/Wearable
https://news.ycombinator.com/item?id=45593093,Hacker News,"Ask HN: Who is working on AI-powered glasses for visually impaired?",Community discussion of AI vision assistance for blind/low-vision on smart glasses,Smart Glasses/Wearable
https://news.ycombinator.com/item?id=43089727,Hacker News,"Coral USB Accelerator with Google Edge TPU (75pts/84c)",Local AI inference hardware; alternatives now that Coral is harder to source,Edge AI/Hardware
https://news.ycombinator.com/item?id=39812259,Hacker News,"Supervision: Reusable Computer Vision tools (Roboflow) (236pts/44c)",Open-source library for CV pipeline building blocks (tracking/annotation/zones),CV Platforms/Tools
https://news.ycombinator.com/item?id=39706004,Hacker News,"Show HN: Skyvern -- Browser automation using LLMs and CV (422pts/139c)",Vision models to understand and interact with web pages visually,CV Platforms/Tools
https://news.ycombinator.com/item?id=41938051,Hacker News,"Claude Computer Use -- Is Vision the Ultimate API? (113pts/90c)",Whether vision-based computer interaction is the ultimate universal API,CV Platforms/Tools
https://news.ycombinator.com/item?id=44007087,Hacker News,"Show HN: AI that watches and chats in YouTube/Twitch live streams",AI observing live streams and engaging in chat about what it sees in real-time,Real-time Video
https://news.ycombinator.com/item?id=46658773,Hacker News,"Video-to-Grid: Analyze videos with one Vision API call",Turns video into 2D thumbnail grid for full video context in one API call,Real-time Video
https://news.ycombinator.com/item?id=46665035,Hacker News,"30min video analysis for $0.003 via frame-tiling and Vision API",Extremely cheap video analysis using frame tiling -- directly relevant to cost model,Real-time Video
https://x.com/OfficialLoganK/status/1866873298027446465,Twitter/X,"Logan Kilpatrick: Gemini 2.0 Multimodal Live API launch",Stream audio/video/text with dynamic tool calls (Search/code/function calling),Gemini/Multimodal API
https://x.com/googledevs/status/1866873036235771969,Twitter/X,"Google Devs: Build with Gemini 2.0 Flash + Multimodal Live API",Official announcement of Gemini 2.0 Flash with Multimodal Live API and native tool use,Gemini/Multimodal API
https://x.com/addyosmani/status/1868407356251607444,Twitter/X,"Addy Osmani: Gemini 2.0 Multimodal Live API code samples",React code examples for Gemini 2.0 + Multimodal Live API,Gemini/Multimodal API
https://x.com/_philschmid/status/1915360039570739283,Twitter/X,"Philipp Schmid: Next-gen multimodal agents with Gemini Live API",Personalized real-time multimodal agents powered by Gemini 2.0 Flash + Live API + ADK,Gemini/Multimodal API
https://x.com/triswarkentin/status/1925272680615583896,Twitter/X,"Tris Warkentin: Gemma 3n multimodal live video on phone",Local multimodal live video understanding on a phone; comparing progress from Astra demo,Gemini/Multimodal API
https://x.com/DSkaale/status/2018215456499179848,Twitter/X,"Omnia AI Video Editor with Gemini API key (BYOK)",Indie dev using same BYOK Gemini key pattern as Trio; 100+ prompt templates,Gemini/Multimodal API
https://x.com/ChromiumDev/status/1859664256330780918,Twitter/X,"ViddyScribe: Gemini API video accessibility app (competition winner)",Uses Gemini to generate audio descriptions for any video,Gemini/Multimodal API
https://x.com/diegocabezas01/status/1892428514692939778,Twitter/X,"Diego: LLM Vision + Camera in Home Assistant tutorial",Tutorial on using LLM Vision to analyze camera images/video in Home Assistant,Security Camera AI
https://x.com/rohanpaul_ai/status/2004717616695574799,Twitter/X,"Stanford QuantiPhy: VLMs guess motion instead of measuring",VLMs mostly guess motion from common sense instead of actually measuring video,VLM/Video Understanding
https://x.com/rohanpaul_ai/status/1994549868946493952,Twitter/X,"Qwen3-VL: 256K context for text/images/video",Handles long mixes of text/images/video without degradation; native 256K context,VLM/Video Understanding
https://x.com/cwolferesearch/status/1906717846496759977,Twitter/X,"Cameron Wolfe: How Vision LLMs work (architecture explainer)",VLM architectures: LLM backbone + vision encoder extending text LLMs to visual modalities,VLM/Video Understanding
https://x.com/_akhaliq/status/1769563834107170892,Twitter/X,"AK: VideoAgent -- Long-form video understanding with LLM agents",LLM as agent for long-form video understanding; significant CV challenge,VLM/Video Understanding
https://x.com/rohanpaul_ai/status/1877816487886655566,Twitter/X,"LLaVA-Mini: visual understanding in 1 token",Compresses visual inputs to 1 vision token for real-time multimodal interactions,VLM/Video Understanding
https://x.com/mbzuai/status/1942212933792006237,Twitter/X,"Mobile-VideoGPT: open-source compact video model for edge",Addresses pain that GPT-4/Gemini are cloud-only for video; real-time edge solution,VLM/Video Understanding
https://x.com/AIatMeta/status/1920153975921521018,Twitter/X,"Meta PLM: open vision-language model",Perception Language Model -- open & reproducible VLM for challenging visual tasks,VLM/Video Understanding
https://x.com/roboflow/status/1948342081442795929,Twitter/X,"RF-DETR nano for wearables and mobile",Real-time AI for wearables now possible; 11 mAP higher than YOLO at 0.17ms faster,Object Detection
https://x.com/roboflow/status/1990095813272310123,Twitter/X,"RF-DETR SOTA for detection AND segmentation",YOLO vs transformers comparison; RF-DETR now state of the art for both tasks,Object Detection
https://x.com/skalskip92/status/1743343196585730152,Twitter/X,"Piotr Skalski: YOLO-NAS vehicle speed estimation on Jetson Nano",Real-time vehicle detection on low-compute edge devices,Object Detection
https://x.com/ultralytics/status/1841010357994668114,Twitter/X,"Ultralytics: YOLOv8 traffic signal violation detection",Real-time traffic violation detection system using YOLOv8,Object Detection
https://x.com/Papapishu/status/1756748802495553587,Twitter/X,"Chris Person exploring open-source NVR options",Concluding Frigate is the most interesting solution; runs locally with HA,Security Camera AI
https://x.com/lamw/status/1659256178206203906,Twitter/X,"William Lam: Full Frigate NVR setup with Google Coral TPU",Detailed setup thread: ESXi + Coral USB TPU + Intel iGPU for video decoding,Security Camera AI
https://x.com/xdadevelopers/status/1961096659519107379,Twitter/X,"XDA: Frigate is the smarter open-source NVR alternative",Case for why Frigate is the smarter choice for home security systems,Security Camera AI
https://x.com/cnxsoft/status/1877566033797558296,Twitter/X,"CNX Software: RPi 5 + Hailo-8 AI accelerator for Frigate",SeeedStudio reComputer with RPi 5 + Hailo-8 that works with Frigate NVR,Edge AI/Hardware
https://x.com/twelve_labs/status/1864388726719221852,Twitter/X,"Twelve Labs: Marengo 2.7 multi-vector video embeddings",Multi-vector embedding architecture for video understanding,CV Platforms/Tools
https://x.com/twelve_labs/status/1889382094788501815,Twitter/X,"Twelve Labs: Pegasus 1.2 long-form video language model",VLM optimized for long-form video understanding with technical specs,CV Platforms/Tools
https://x.com/OpusClip/status/1821208835778064636,Twitter/X,"OpusClip: ClipAnything multimodal AI video clipping",First multimodal AI clipping using visual/audio/sentiment cues,Real-time Video
https://x.com/Xiaomi/status/1938212876956713165,Twitter/X,"Xiaomi AI Glasses: first-person camera + AI",Wearable with glasses + stereo audio + first-person camera + AI,Smart Glasses/Wearable
https://x.com/NVIDIAAIDev/status/1988049035366732051,Twitter/X,"NVIDIA: Visual AI Agents with Cosmos Reason + Metropolis",Building visual AI agents that see/reason/act using Cosmos Reason VLM,CV Platforms/Tools
https://github.com/blakeblackshear/frigate/discussions/21408,GitHub,"Frigate 0.17 beta: Generative AI totally lost",Users reporting GenAI integration (event descriptions) broken in RC,Security Camera AI
https://github.com/blakeblackshear/frigate/discussions/20552,GitHub,"Frigate+ 2025.3 Base Model Update",New detection model adding object classes; community benchmarking results,Security Camera AI
https://github.com/blakeblackshear/frigate/discussions/21917,GitHub,"Frigate 0.17.0 RC1: CUDA Graphs + new detector support",CUDA Graphs for Nvidia GPUs lowering inference times; active community testing,Security Camera AI
https://github.com/mit-han-lab/streaming-vlm,GitHub,"StreamingVLM: Real-time VLM for infinite video streams",Runs at 8 FPS on single H100; avoids quadratic cost via compact KV cache,VLM/Video Understanding
https://github.com/NVIDIA-AI-IOT/live-vlm-webui,GitHub,"NVIDIA Live VLM WebUI: real-time VLM via webcam",Real-time Vision Language Model interaction via webcam with WebRTC; supports Ollama/vLLM,VLM/Video Understanding
https://github.com/IVGSZ/Flash-VStream,GitHub,"Flash-VStream (ICCV 2025): efficient real-time long video stream understanding",Flash Memory mechanism enabling Q&A on extremely long live streams,VLM/Video Understanding
https://github.com/Mark12Ding/Dispider,GitHub,"Dispider (CVPR 2025): Video LLMs with active real-time interaction",Streaming video LLM with disentangled perception/decision/reaction,VLM/Video Understanding
https://github.com/NVIDIA-AI-Blueprints/video-search-and-summarization,GitHub,"NVIDIA AI Blueprint: Video Search & Summarization",Ingesting massive volumes of live/archived videos using generative AI and VLMs,Real-time Video
https://github.com/GetStream/Vision-Agents,GitHub,"Open Vision Agents by Stream: low-latency vision AI apps",Open-source Python framework; 25+ integrations; sub-500ms latency via edge network,CV Platforms/Tools
https://github.com/insight-platform/Savant,GitHub,"Savant: Video Analytics Framework on DeepStream",Python CV & video analytics framework; declarative YAML pipelines; runs on Jetson,CV Platforms/Tools
https://github.com/yunlong10/Awesome-LLMs-for-Video-Understanding,GitHub,"Awesome LLMs for Video Understanding (IEEE TCSVT survey)",Curated list of Video LLM papers and code; actively maintained,VLM/Video Understanding
https://github.com/MichaelMarav/RealTimeDetectionYoutube,GitHub,"RealTimeDetectionYoutube: YOLO/SSD on YouTube livestreams",Takes a YouTube video/livestream and performs real-time object detection,Real-time Video
https://github.com/orgs/ultralytics/discussions/20800,GitHub,"How to Use YOLOv8 with Live ESP32-CAM Stream?",Developer asking how to connect ESP32-CAM MJPEG stream to YOLOv8 for real-time inference,Object Detection
https://github.com/ultralytics/ultralytics/issues/15810,GitHub,"Real-time RTSP stream with YOLOv8 for people counting + retransmission",Wants to receive RTSP / run YOLOv8 people counting / retransmit via another RTSP,Object Detection
https://github.com/ultralytics/ultralytics/issues/13976,GitHub,"How to achieve real time (>=25 fps) object detection in video stream?",Performance optimization for 25+ FPS with YOLO on live video,Object Detection
https://github.com/orgs/ultralytics/discussions/10106,GitHub,"Slow on RTSP streaming (Ultralytics YOLO)",Community debugging RTSP latency with YOLO; threading/buffer solutions proposed,Object Detection
https://github.com/SharpAI/DeepCamera,GitHub,"DeepCamera: Open-source AI camera platform",Facial recognition / person re-ID / car detection / fall detection using YOLOv7+FastReID,Security Camera AI
https://github.com/roboflow/rf-detr,GitHub,"RF-DETR (ICLR 2026): real-time transformer detection SOTA on COCO",Roboflow real-time transformer-based detection; Apache 2.0; designed for fine-tuning,Object Detection
https://github.com/googleapis/python-genai/issues/378,GitHub,"Gemini API suddenly started failing for Video Understanding",Video understanding calls broke without code changes; active debugging thread,Gemini/Multimodal API
https://github.com/googleapis/python-genai/issues/1890,GitHub,"Batch API with gemini-3-flash returns error 13 for video input",Video processing failures on newer Gemini models while older models work fine,Gemini/Multimodal API
https://github.com/PhazerTech/yolo-rtsp-security-cam,GitHub,"YOLO RTSP Security Cam: Python RTSP app with YOLO detection",Configurable object class filtering for security camera feeds,Security Camera AI
https://github.com/kucau0901/frigem,GitHub,"Frigem: Frigate + Gemini 2.0 custom HA component",Feeds Frigate NVR video clips to Gemini 2.0 for natural language scene descriptions,Security Camera AI
https://www.producthunt.com/products/twelvelabs?launch=twelvelabs,Product Hunt,"TwelveLabs Marengo 3.0 launch",Multimodal embedding model for video understanding across 36 languages,CV Platforms/Tools
https://www.producthunt.com/products/roboflow,Product Hunt,"Roboflow: CV platform for detection model deployment",Image annotation/preprocessing/deployment; widely discussed in comments,CV Platforms/Tools
https://www.producthunt.com/products/aicam,Product Hunt,"AiCam: turns old phones into AI security cameras",Smart alerts and offline event detection for complete data privacy,Security Camera AI
https://www.producthunt.com/products/ultrainstinct-ai,Product Hunt,"UltraInstinct AI: smart security with facial grouping",Cameras identify threats with centralized monitoring and cloth identification,Security Camera AI
https://www.producthunt.com/posts/kuasar-video-ai,Product Hunt,"Kuasar Video AI: social media video analytics",AI scoring videos / analyzing audience preferences / competitive insights,CV Platforms/Tools
https://www.producthunt.com/products/tl-dr-5,Product Hunt,"TL;DR: AI-powered livestream moments extraction",Automatically identifies and shares best moments from live streams,Real-time Video
https://dev.to/getstreamhq/build-a-realtime-video-restyling-agent-with-gemini-3-decart-ai-39df,Dev.to,"Build a Realtime Video Restyling Agent with Gemini 3 + Decart AI",Pairing Gemini 3 with Decart AI for zero-latency video restyling at 24 FPS,Gemini/Multimodal API
https://dev.to/jubinsoni/mastering-the-gemini-3-api-architecting-next-gen-multimodal-ai-applications-5c2,Dev.to,"Mastering the Gemini 3 API: Next-Gen Multimodal AI Applications",Deep-dive into Gemini 3 architecture for production-ready multimodal apps,Gemini/Multimodal API
https://dev.to/paul_ruiz_309c84cf705354e/video-understanding-with-gemini-30-flash-for-robotics-5896,Dev.to,"Video Understanding with Gemini 3.0 Flash for Robotics",Gemini multimodal video understanding applied to robotics use cases,VLM/Video Understanding
https://dev.to/abhinowww/building-a-real-time-object-detection-application-with-yolo-2b60,Dev.to,"Building a Real-Time Object Detection Application with YOLO",Practical walkthrough for real-time YOLO detection for surveillance/autonomous vehicles,Object Detection
https://dev.to/emmanuelthecoder/build-a-calorie-estimation-app-with-vision-agents-750,Dev.to,"Build a Calorie Estimation App with Vision Agents",Point camera at food to estimate calories via computer vision SDK,CV Platforms/Tools
https://dev.to/getstreamhq/build-a-voice-controlled-github-agent-in-python-mcp-vision-agents-l5p,Dev.to,"Build a Voice-Controlled GitHub Agent (MCP + Vision Agents)",Combining Vision Agents framework with MCP for voice-controlled AI over video,CV Platforms/Tools
https://www.indiehackers.com/post/latest-open-source-project-for-quick-and-easy-computer-vision-829dcc5fed,Indie Hackers,"Detecto: easy open-source computer vision in 10 lines",Lowering the barrier to CV with a simple Python package for object detection,CV Platforms/Tools
https://www.indiehackers.com/post/thinking-of-building-an-ai-startup-read-this-first-5ce1bc01b8,Indie Hackers,"Building an AI startup? Read this first",Moat concerns and differentiation strategies beyond OpenAI wrappers for vision/video AI,Community/Discussion
https://www.indiehackers.com/post/startup-launch-an-ai-based-video-creation-website-currently-free-77e3ebc4f5,Indie Hackers,"Startup Launch: AI-Based Video Creation Website (ImageMover)",Indie hacker launching image-to-video and script-to-video generation tool,Real-time Video
https://forum.opencv.org/t/rtsp-is-slow-when-using-opencv/1731,OpenCV Forum,"RTSP is slow when using OpenCV",Frame-loss and latency issues during AI inference on RTSP streams,Object Detection
https://forum.opencv.org/t/lot-of-delay-with-my-rtsp-cam-with-opencv-on-python/253,OpenCV Forum,"Lot of Delay with my RTSP cam with OpenCV on Python",RTSP latency solutions: GStreamer pipelines / threading / buffer tuning,Object Detection
https://discuss.ai.google.dev/t/python-implementation-for-real-time-video-stream-analysis-with-gemini-2-0-multimodal-live-api/55873,Google AI Forum,"Python real-time video stream analysis with Gemini 2.0 Live API",Developer sharing Python implementation for real-time video analysis with Gemini,Gemini/Multimodal API
https://discuss.ai.google.dev/t/live-with-video-and-audio-input-api-and-docs/54428,Google AI Forum,"Live with video and audio input API and docs",Developers discussing Live API with combined video+audio input for real-time analysis,Gemini/Multimodal API
https://discuss.ai.google.dev/t/gemini-2-0-video-understanding/58261,Google AI Forum,"Gemini 2.0 Video Understanding capabilities and limitations",Community thread on Gemini 2.0 video understanding limits,Gemini/Multimodal API
https://discuss.ai.google.dev/t/gemini-2-0-stream-realtime-uses-rear-camera-instead-of-front-camera/54696,Google AI Forum,"Gemini 2.0 camera streaming: front vs rear camera bug",Developer troubleshooting real-time camera streaming with Gemini 2.0,Gemini/Multimodal API
https://discuss.ai.google.dev/t/cant-upload-mp4-to-client/79475,Google AI Forum,"Can't upload mp4 to Gemini API client",Users unable to upload MP4 video files; debugging format and size issues,Gemini/Multimodal API
https://discuss.ai.google.dev/t/google-ai-studio-will-not-upload-video-it-just-continues-continues-to-load/80939,Google AI Forum,"Google AI Studio video upload hangs indefinitely",Multiple users confirming video upload hangs across Drive and local uploads,Gemini/Multimodal API
https://discuss.ai.google.dev/t/file-upload-not-working/82090,Google AI Forum,"Gemini API file upload not working",Ongoing thread about Gemini API file upload failures affecting video workflows,Gemini/Multimodal API
https://discuss.roboflow.com/t/real-time-video-single-object-motion-detection/7254,Roboflow Forum,"Real time video single object motion detection",How to detect motion of single object in real-time using Roboflow inference,Object Detection
https://community.hailo.ai/t/object-detection-on-an-rtsp-stream/8232,Hailo Community,"Object Detection on an RTSP Stream with Hailo accelerators",Running detection models on RTSP streams using Hailo edge AI hardware,Edge AI/Hardware
https://community.home-assistant.io/t/setting-up-frigate-in-2025/894542,Home Assistant,"Setting up Frigate in 2025",Step-by-step guide for Frigate NVR with AI object detection in 2025,Security Camera AI
https://community.home-assistant.io/t/blueprint-frigate-vision-ai-powered-notifications-with-llm-recognition-cooldowns-multi-cam-logic-v0-9/907582,Home Assistant,"Frigate Vision Blueprint v0.9: AI-powered notifications",Combining Frigate + LLM recognition with cooldowns and multi-camera logic,Security Camera AI
