URL,Platform,Title,Topic/Pain Point,Category
https://community.home-assistant.io/t/camera-frigate-intelligent-ai-powered-notifications/785335,Home Assistant,"Frigate Intelligent AI Notifications (10+ pages of discussion)",Multimodal AI interpreting camera feeds for context-aware security notifications,Security Camera AI
https://community.home-assistant.io/t/node-red-frigate-google-ai-image-recognition-and-notifications/731822,Home Assistant,"Node-Red + Frigate + Google AI for image recognition",Combining Node-Red / Frigate / Google AI for smart camera notifications,Security Camera AI
https://community.home-assistant.io/t/send-frigate-snapshots-thumbnails-to-google-gemini-pro/713996,Home Assistant,"Send Frigate snapshots to Google Gemini Pro",Sending camera snapshots to Gemini Pro for natural language scene descriptions,Security Camera AI
https://community.home-assistant.io/t/gemini-live-api-webrtc-integration/915915,Home Assistant,"Gemini Live API WebRTC Integration for real-time camera analysis",Integrating Gemini Live API with WebRTC for real-time camera analysis in HA,Gemini/Multimodal API
https://community.home-assistant.io/t/llm-vision-let-home-assistant-see/729241,Home Assistant,"LLM Vision: Let Home Assistant See",Custom integration using multimodal LLMs to analyze images/videos/live camera feeds,Security Camera AI
https://community.home-assistant.io/t/camera-notification-v0-7-with-actionable-buttons-android-ios-frigate-llm-vision-ai/887614,Home Assistant,"Camera Notification with Frigate + LLM Vision AI + actionable buttons",Blueprint combining Frigate + LLM Vision AI with actionable notification buttons,Security Camera AI
https://discuss.huggingface.co/t/a-model-i-can-use-with-video-data/160097,Hugging Face,"A model I can use with video data",Exploring VLM models for quality control with video input; model selection discussion,VLM/Video Understanding
https://discuss.huggingface.co/t/apollo-video-understanding-models/161766,Hugging Face,"Apollo Video Understanding Models",Discussion on Apollo video model; broken links and inference code availability,VLM/Video Understanding
https://discuss.huggingface.co/t/what-open-source-multi-modal-language-models-can-take-multiple-videos-as-input/136849,Hugging Face,"Open-source multimodal LLMs accepting multiple videos as input",Which models (Qwen-2VL etc.) can accept multiple videos as input,VLM/Video Understanding
https://forum.opencv.org/t/request-for-feedback-gsoc-2025-proposal-on-opencv-model-zoo-quantization/20683,OpenCV Forum,"GSoC 2025: Model Zoo Quantization for edge deployment",Integrating quantized deep learning models into OpenCV Model Zoo,Edge AI/Hardware
https://forum.opencv.org/t/opencv-5-roadmap/22220,OpenCV Forum,"OpenCV 5 Roadmap discussion",Community discussion on OpenCV 5 alpha and planned features,CV Platforms/Tools
https://discuss.pytorch.org/t/video-action-recognition-with-small-dataset-non-human-what-model-would-you-recommend/164797,PyTorch Forums,"Video action recognition with small dataset (non-human)",Model recommendations for video action recognition on non-human subjects,VLM/Video Understanding
https://discuss.pytorch.org/t/cnn-lstm-for-video-classification/185303,PyTorch Forums,"CNN+LSTM for video classification",Architecture approaches for video classification tasks,VLM/Video Understanding
https://www.linkedin.com/posts/adiack_getting-started-with-gemini-20-multimodal-activity-7278847399911907329-BcPV,LinkedIn,"Getting started with Gemini 2.0 Multimodal Live API tutorial",Tutorial post on Gemini 2.0 Multimodal Live API,Gemini/Multimodal API
https://www.linkedin.com/posts/addyosmani_ai-programming-softwareengineering-activity-7405299691761889280-yg-n,LinkedIn,"Addy Osmani: Gemini Live API Now GA",Gemini Live API reaching general availability with real-time audio capabilities,Gemini/Multimodal API
https://www.linkedin.com/posts/logankilpatrick_gemini-15-pro-now-available-in-180-countries-activity-7183501626081509376-JmYN,LinkedIn,"Logan Kilpatrick: Gemini 1.5 Pro launch (20 comments)",Gemini 1.5 Pro with native audio/video understanding in 180+ countries,Gemini/Multimodal API
https://www.linkedin.com/posts/alphasignal_yolov9-is-out-its-a-real-time-object-detection-activity-7166791079940280321-CP6l,LinkedIn,"AlphaSignal: YOLOv9 launch announcement",YOLOv9 surpassing convolution/transformer-based detection models,Object Detection
https://www.linkedin.com/posts/ultralytics_computervision-objecttracking-yolov8-activity-7132668978509824001-J6nX,LinkedIn,"Ultralytics: YOLOv8 Multi-Stream Tracking",Multi-stream object tracking capabilities demo,Object Detection
https://www.linkedin.com/posts/satyamallick_yolo-yolov8-yolov5-activity-7018608238350778368-rLbR,LinkedIn,"Satya Mallick (OpenCV CEO): YOLO variants (30 comments)",High-engagement discussion of YOLO object detection variants,Object Detection
https://www.linkedin.com/posts/cardinalpeak_council-post-edge-ai-the-ai-no-one-is-talking-activity-7125911963045408768-M4Xq,LinkedIn,"Forbes: Edge AI redefining real-time decisions",Processing data closer to source for real-time edge AI decisions,Edge AI/Hardware
https://www.linkedin.com/posts/bobbysharma_bluestone-equity-partners-has-taken-a-45-activity-7142509529417613313-TtNw,LinkedIn,"$45M investment in AI video startup (14 comments)",Bluestone Equity investing $45M in AI video content analysis,Community/Discussion
https://discord.com/invite/hugging-face-879548962464493619,Discord,"Hugging Face Discord (203K members)",#computer-vision and #cv-study-group channels; active VLM research discussions,Community/Discord
https://discord.com/invite/ultralytics,Discord,"Ultralytics YOLO Discord (6.3K members)",YOLO models / real-time detection / vision AI deployment discussions,Community/Discord
https://discord.com/invite/learnaitogether,Discord,"Learn AI Together Discord (90K members)",CV/NLP/GenAI with weekly reading groups and project collaboration,Community/Discord
https://discord.com/invite/GbfgXGJ8Bk,Discord,"Roboflow Discord (500+ members)",CV practitioners discussing model training and deployment pipelines,Community/Discord
https://discord.com/invite/fiftyone-community,Discord,"FiftyOne / Voxel51 Discord (2.4K members)",Dataset curation / model evaluation / visual AI workflows,Community/Discord
https://discord.com/invite/4RMwz64gdH,Discord,"MLSpace Discord (31K members)",Deep learning / Python / Kaggle / applied CV community,Community/Discord
